[
  {
      "title": "title_a",
      "description": "description_a",
      "deadline": "1988-04-12T23:20:50.52Z",
      "created": "1985-04-12T23:20:50.52Z",
      "updated": "1986-04-12T23:20:50.52Z",
      "closed": "1987-04-12T23:20:50.52Z",
      "state": "closed"
  },
  {
      "title": "title_b",
      "description": "description_b",
      "deadline": "1998-04-12T23:20:50.52Z",
      "created": "1995-04-12T23:20:50.52Z",
      "updated": "1996-04-12T23:20:50.52Z",
      "closed": null,
      "state": "open"
  }
]
